<?xml version="1.0" encoding="UTF-8"?>
<audioGenerator xmlns:xsi="http://www.w3.org/2001/XMLSchema-instance"
  xsi:noNamespaceSchemaLocation="generator.xsd"
  name="HPR Audio Generator"
  version="0.1.0">
  <purpose>Generate and curate short audio loops independently from all visual media.</purpose>
  <libraryTarget approved="150" provisional="175"/>
  <outputFormat sampleRate="48000" channels="2" sampleWidthBits="16" format="WAV"/>
  <profiles>
    <profile id="AP-001" name="Ultra Sparse" status="Active" density="ultra sparse" energy="very low" bedGainDb="-22" gestureGainDb="-30" minGestures="1" maxGestures="1" avoidFirstSec="1" avoidLastSec="1"><notes>Safest first-pass profile.</notes></profile>
    <profile id="AP-002" name="Sparse" status="Active" density="sparse" energy="low" bedGainDb="-20" gestureGainDb="-28" minGestures="1" maxGestures="1" avoidFirstSec="1" avoidLastSec="1"><notes>Restrained with one nearby event.</notes></profile>
    <profile id="AP-003" name="Light" status="Experimental" density="light" energy="low" bedGainDb="-19" gestureGainDb="-27" minGestures="1" maxGestures="2" avoidFirstSec="1" avoidLastSec="1"><notes>Allows a second gesture in a later generator version.</notes></profile>
  </profiles>
  <recipes>
    <recipe id="AR-001" name="Open Field / Tactile" status="Active" durationSec="7" profileId="AP-001" candidateCount="10"><randomization>random active bed + random active gesture</randomization><notes>Baseline proof recipe.</notes></recipe>
    <recipe id="AR-002" name="Interior / Cloth" status="Active" durationSec="9" profileId="AP-002" bedFamily="Interior Mechanical" gestureFamily="Cloth" candidateCount="10"><randomization>constrained by family</randomization><notes>Quiet interior with clothing movement.</notes></recipe>
    <recipe id="AR-003" name="Air / Presence" status="Active" durationSec="11" profileId="AP-001" bedFamily="Nature Air" gestureFamily="Presence" candidateCount="10"><randomization>constrained by family</randomization><notes>Open air with nearly subliminal human presence.</notes></recipe>
    <recipe id="AR-004" name="Water / Touch" status="Experimental" durationSec="9" profileId="AP-002" bedFamily="Water Creek" gestureFamily="Touch" candidateCount="10"><randomization>constrained by family</randomization><notes>Fluid bed with tactile event.</notes></recipe>
    <recipe id="AR-005" name="Urban / Wood" status="Experimental" durationSec="7" profileId="AP-002" bedFamily="Urban Road" gestureFamily="Wood" candidateCount="10"><randomization>constrained by family</randomization><notes>Distant city with a nearby material event.</notes></recipe>
  </recipes>
  <assets>
    <asset id="SA-B-001" name="Ambience Nature Field Windy 02" role="Bed" family="Nature Air" path="audio/source/beds/01-nature-air/Ambience Nature Field Windy 02.wav" source="Adobe" durationSec="90.111" sampleRate="48000" channels="2" sampleWidthBits="16" initialRating="3" approvedForUse="Yes" status="Active"/>
    <asset id="SA-B-002" name="Ambience Nature Trail 180 01" role="Bed" family="Nature Air" path="audio/source/beds/01-nature-air/Ambience Nature Trail 180 01.wav" source="Adobe" durationSec="90.112" sampleRate="48000" channels="2" sampleWidthBits="16" initialRating="3" approvedForUse="Yes" status="Active"/>
    <asset id="SA-B-003" name="Ambience Wind Blowing Through Trees 01" role="Bed" family="Nature Air" path="audio/source/beds/01-nature-air/Ambience Wind Blowing Through Trees 01.wav" source="Adobe" durationSec="90.200" sampleRate="48000" channels="2" sampleWidthBits="16" initialRating="3" approvedForUse="Yes" status="Active"/>
    <asset id="SA-B-004" name="Ambience Wind With Crickets 01" role="Bed" family="Nature Air" path="audio/source/beds/01-nature-air/Ambience Wind With Crickets 01.wav" source="Adobe" durationSec="90.112" sampleRate="48000" channels="2" sampleWidthBits="16" initialRating="3" approvedForUse="Yes" status="Active"/>
    <asset id="SA-B-005" name="Ambience Bridge Over Creek 01" role="Bed" family="Water Creek" path="audio/source/beds/02-water-creek/Ambience Bridge Over Creek 01.wav" source="Adobe" durationSec="90.108" sampleRate="48000" channels="2" sampleWidthBits="16" initialRating="3" approvedForUse="Yes" status="Active"/>
    <asset id="SA-B-006" name="Ambience Creek In The Woods 180 01" role="Bed" family="Water Creek" path="audio/source/beds/02-water-creek/Ambience Creek In The Woods 180 01.wav" source="Adobe" durationSec="90.094" sampleRate="48000" channels="2" sampleWidthBits="16" initialRating="3" approvedForUse="Yes" status="Active"/>
    <asset id="SA-B-007" name="Ambience Stream 01" role="Bed" family="Water Creek" path="audio/source/beds/02-water-creek/Ambience Stream 01.wav" source="Adobe" durationSec="90.112" sampleRate="48000" channels="2" sampleWidthBits="16" initialRating="3" approvedForUse="Yes" status="Active"/>
    <asset id="SA-B-008" name="Ambience Car Parked Interior Windshield Wipers On Low 01" role="Bed" family="Rain Weather" path="audio/source/beds/03-rain-weather/Ambience Car Parked Interior Windshield Wipers On Low 01.wav" source="Adobe" durationSec="90.094" sampleRate="48000" channels="2" sampleWidthBits="16" initialRating="3" approvedForUse="Yes" status="Active"/>
    <asset id="SA-B-009" name="Ambience Rain And Birds 01" role="Bed" family="Rain Weather" path="audio/source/beds/03-rain-weather/Ambience Rain And Birds 01.wav" source="Adobe" durationSec="90.119" sampleRate="48000" channels="2" sampleWidthBits="16" initialRating="3" approvedForUse="Yes" status="Active"/>
    <asset id="SA-B-010" name="Ambience Busy Road 180D 02" role="Bed" family="Urban Road" path="audio/source/beds/04-urban-road/Ambience Busy Road 180D 02.wav" source="Adobe" durationSec="90.020" sampleRate="48000" channels="2" sampleWidthBits="16" initialRating="3" approvedForUse="Yes" status="Active"/>
    <asset id="SA-B-011" name="Ambience Car Drive Interior All Windows Up 01" role="Bed" family="Urban Road" path="audio/source/beds/04-urban-road/Ambience Car Drive Interior All Windows Up 01.wav" source="Adobe" durationSec="90.096" sampleRate="48000" channels="2" sampleWidthBits="16" initialRating="3" approvedForUse="Yes" status="Active"/>
    <asset id="SA-B-012" name="Ambience Car Driving Interior Back Seat Windows Down 01" role="Bed" family="Urban Road" path="audio/source/beds/04-urban-road/Ambience Car Driving Interior Back Seat Windows Down 01.wav" source="Adobe" durationSec="90.100" sampleRate="48000" channels="2" sampleWidthBits="16" initialRating="3" approvedForUse="Yes" status="Active"/>
    <asset id="SA-B-013" name="Ambience Court House Entrance 01" role="Bed" family="Urban Road" path="audio/source/beds/04-urban-road/Ambience Court House Entrance 01.wav" source="Adobe" durationSec="90.190" sampleRate="48000" channels="2" sampleWidthBits="16" initialRating="3" approvedForUse="Yes" status="Active"/>
    <asset id="SA-B-014" name="Ambience Children Group Playground Distant 01" role="Bed" family="Human Distant" path="audio/source/beds/05-human-distant/Ambience Children Group Playground Distant 01.wav" source="Adobe" durationSec="90.000" sampleRate="48000" channels="2" sampleWidthBits="16" initialRating="3" approvedForUse="Yes" status="Active"/>
    <asset id="SA-B-015" name="Ambience Ice Rink Two People Skate 01" role="Bed" family="Human Distant" path="audio/source/beds/05-human-distant/Ambience Ice Rink Two People Skate 01.wav" source="Adobe" durationSec="90.112" sampleRate="48000" channels="2" sampleWidthBits="16" initialRating="3" approvedForUse="Yes" status="Active"/>
    <asset id="SA-B-016" name="Ambience Air Conditioner 180 01" role="Bed" family="Interior Mechanical" path="audio/source/beds/06-interior-mechanical/Ambience Air Conditioner 180 01.wav" source="Adobe" durationSec="90.116" sampleRate="48000" channels="2" sampleWidthBits="16" initialRating="3" approvedForUse="Yes" status="Active"/>
    <asset id="SA-B-017" name="Ambience Ceiling Fan 01" role="Bed" family="Interior Mechanical" path="audio/source/beds/06-interior-mechanical/Ambience Ceiling Fan 01.wav" source="Adobe" durationSec="90.096" sampleRate="48000" channels="2" sampleWidthBits="16" initialRating="3" approvedForUse="Yes" status="Active"/>
    <asset id="SA-B-018" name="Ambience Office Scanner 01" role="Bed" family="Interior Mechanical" path="audio/source/beds/06-interior-mechanical/Ambience Office Scanner 01.wav" source="Adobe" durationSec="74.000" sampleRate="48000" channels="2" sampleWidthBits="16" initialRating="3" approvedForUse="Yes" status="Active"/>
    <asset id="SA-B-019" name="Ambience Stairway 01" role="Bed" family="Interior Mechanical" path="audio/source/beds/06-interior-mechanical/Ambience Stairway 01.wav" source="Adobe" durationSec="90.112" sampleRate="48000" channels="2" sampleWidthBits="16" initialRating="3" approvedForUse="Yes" status="Active"/>
    <asset id="SA-B-020" name="Ambience Stairway Near Elevator 02" role="Bed" family="Interior Mechanical" path="audio/source/beds/06-interior-mechanical/Ambience Stairway Near Elevator 02.wav" source="Adobe" durationSec="90.112" sampleRate="48000" channels="2" sampleWidthBits="16" initialRating="3" approvedForUse="Yes" status="Active"/>
    <asset id="SA-B-021" name="Ambience Theater Film Running 01" role="Bed" family="Interior Mechanical" path="audio/source/beds/06-interior-mechanical/Ambience Theater Film Running 01.wav" source="Adobe" durationSec="90.000" sampleRate="48000" channels="2" sampleWidthBits="16" initialRating="3" approvedForUse="Yes" status="Active"/>
    <asset id="SA-G-001" name="Human Crowd Sigh Soft 04" role="Gesture" family="Presence" path="audio/source/gestures/01-presence/Human Crowd Sigh Soft 04.wav" source="Adobe" durationSec="1.466" sampleRate="48000" channels="2" sampleWidthBits="16" initialRating="3" approvedForUse="Yes" status="Active"/>